{
  "schema_version": "1.0.0",
  "run_id": "fastcat.mapped_bam_pipeline.hg38_wgs_mapped.rep1",
  "timestamp_utc": "2026-04-12T11:42:20Z",
  "benchmark_framework_version": "tool-wrapper-contract-example",
  "scenario": "mapped_bam_pipeline",
  "workflow_variant": "unsupported",
  "tool": "fastcat",
  "tool_version": "fastcat 0.7.4",
  "input": {
    "source_input_id": "hg38_wgs_mapped",
    "source_input_path": "/data/benchmarks/hg38_wgs.mapped.bam",
    "source_input_type": "BAM",
    "source_category": "mapped_bam",
    "staged_input_id": "hg38_wgs_mapped",
    "staged_input_path": "/scratch/bench/hg38_wgs_mapped.staged.bam",
    "input_type": "BAM",
    "mapped_state": "mapped",
    "input_basename": "hg38_wgs.mapped.bam",
    "input_bytes": 128000000000,
    "records_processed": 860000000,
    "expected_sort_order": "coordinate",
    "has_index": true,
    "reference_context": "{\"build_label\":\"GRCh38 primary assembly\",\"fasta_path\":\"/references/GRCh38/GRCh38.primary.fa\",\"required_for_interpretation\":true}"
  },
  "staging": {
    "staging_mode": "hardlink",
    "staging_realization": "hardlink_or_copy_fallback",
    "scenario_materialization": "source_or_subsampled_bam",
    "reuse_materialized_inputs": true,
    "include_in_timing": false,
    "storage_context": "local_ssd"
  },
  "subsampling": {
    "enabled": true,
    "fraction": 0.1,
    "seed": 104729,
    "mode": "deterministic",
    "derived_input_id": "hg38_wgs_mapped"
  },
  "resources": {
    "threads": 8,
    "container_image": "bamana-bench:latest",
    "memory_target": null,
    "hardware_host_label": null
  },
  "execution": {
    "replicate": 1,
    "warmup_run": false,
    "command_line": "true",
    "started_at": "2026-04-12T11:42:20Z",
    "finished_at": "2026-04-12T11:42:20Z",
    "wall_seconds": null,
    "user_cpu_seconds": null,
    "system_cpu_seconds": null,
    "cpu_seconds": null,
    "max_rss_bytes": null,
    "exit_code": 0
  },
  "result": {
    "status": "unsupported",
    "success": false,
    "unsupported": true,
    "failed": false,
    "failure_category": null,
    "semantic_equivalence": "unsupported",
    "support_status": "unsupported",
    "output_path": "",
    "output_bytes": null,
    "compression_ratio": null,
    "records_processed": 860000000,
    "throughput_records_per_sec": null,
    "throughput_bytes_per_sec": null,
    "generated_files": []
  },
  "notes": [
    "fastcat is not benchmarked for mapped BAM pipeline scenarios in the current contract."
  ]
}
